{
  "kind": "mortalos.pulse",
  "body": {
    "protocol_version": "mortalos/0",
    "organism_id": "mortalos:OOOOOOOOOOOOOOOOOOOOOOOOOOOOOOOOOOOOOOOOOOO",
    "sequence": "1",
    "parent_hash": "sha256:PPPPPPPPPPPPPPPPPPPPPPPPPPPPPPPPPPPPPPPPPPP",
    "genome_hash": "sha256:GGGGGGGGGGGGGGGGGGGGGGGGGGGGGGGGGGGGGGGGGGG",
    "current_custody_hash": "sha256:KKKKKKKKKKKKKKKKKKKKKKKKKKKKKKKKKKKKKKKKKKK",
    "state_root": "sha256:SSSSSSSSSSSSSSSSSSSSSSSSSSSSSSSSSSSSSSSSSSS",
    "event": {
      "kind": "heartbeat",
      "payload_hash": "sha256:EEEEEEEEEEEEEEEEEEEEEEEEEEEEEEEEEEEEEEEEEEE"
    },
    "next_custodians": [
      {
        "key_id": "peer:AAAAAAAAAAAAAAAAAAAAAAAAAAAAAAAAAAAAAAAAAAA",
        "public_key": "ed25519:AAAAAAAAAAAAAAAAAAAAAAAAAAAAAAAAAAAAAAAAAAA"
      },
      {
        "key_id": "peer:BBBBBBBBBBBBBBBBBBBBBBBBBBBBBBBBBBBBBBBBBBB",
        "public_key": "ed25519:BBBBBBBBBBBBBBBBBBBBBBBBBBBBBBBBBBBBBBBBBBB"
      },
      {
        "key_id": "peer:CCCCCCCCCCCCCCCCCCCCCCCCCCCCCCCCCCCCCCCCCCC",
        "public_key": "ed25519:CCCCCCCCCCCCCCCCCCCCCCCCCCCCCCCCCCCCCCCCCCC"
      }
    ],
    "next_quorum": {
      "type": "threshold",
      "threshold": 2
    }
  },
  "approvals": [
    {
      "key_id": "peer:AAAAAAAAAAAAAAAAAAAAAAAAAAAAAAAAAAAAAAAAAAA",
      "signature": "ed25519:AAAAAAAAAAAAAAAAAAAAAAAAAAAAAAAAAAAAAAAAAAAAAAAAAAAAAAAAAAAAAAAAAAAAAAAAAAAAAAAAAAAAAA"
    },
    {
      "key_id": "peer:BBBBBBBBBBBBBBBBBBBBBBBBBBBBBBBBBBBBBBBBBBB",
      "signature": "ed25519:BBBBBBBBBBBBBBBBBBBBBBBBBBBBBBBBBBBBBBBBBBBBBBBBBBBBBBBBBBBBBBBBBBBBBBBBBBBBBBBBBBBBBB"
    }
  ],
  "acceptances": []
}
